<?xml version="1.0" encoding="UTF-8"?>
<Saglasnost  xmlns:tip="http://www.xws.org/tipovi"
             xmlns:vc="http://www.w3.org/2007/XMLSchema-versioning"
             xmlns="http://www.xws.org/saglasnost"
             xmlns:pred="http://www.xws.org/predicate"
             xmlns:xsi="http://www.w3.org/2001/XMLSchema-instance"
             xsi:schemaLocation="http://www.xws.org/saglasnost file:../xsd/saglasnost.xsd"
             id="d68ae50a-7cca-4684-9500-f2ea908013f3"
             about="http://www.xws.org/saglasnost#d68ae50a-7cca-4684-9500-f2ea908013f3">
    <Datum property="pred:datumIzdavanja" datatype="xs:date">2006-05-04</Datum>
    <Pacijent>
        <tip:Ime>Ime0</tip:Ime>
        <tip:Prezime>Prezime0</tip:Prezime>
        <tip:Datum_rodjenja>2006-05-04</tip:Datum_rodjenja>
        <Drzavljanstvo>
            <Naziv_stranog_drzavljanstva>Naziv_stranog_drzavljanstva0</Naziv_stranog_drzavljanstva>
            <Broj_pasosa rel="pred:identifikatorKorisnika" href="http://www.xws.org/korisnici#921909aa-8ff1-47f4-b761-4cbac06929ad">Broj_pasosa0</Broj_pasosa>
        </Drzavljanstvo>
        <Ime_roditelja>Ime_roditelja0</Ime_roditelja>
        <Pol>M</Pol>
        <Mesto_rodjenja>Mesto_rodjenja0</Mesto_rodjenja>
        <Adresa>
            <Opstina>Opstina0</Opstina>
            <Naselje>Naselje0</Naselje>
            <Ulica>Ulica0</Ulica>
            <Broj>0</Broj>
        </Adresa>
        <Kontakt>
            <tip:E_mail>djordjenjegic@email.com</tip:E_mail>
            <tip:Fiksni_telefon>023456789</tip:Fiksni_telefon>
            <tip:Mobilni_telefon>060123456789</tip:Mobilni_telefon>
        </Kontakt>
        <Radni_status>
            <Penzioner>
            </Penzioner>
        </Radni_status>
        <Korisnik_ustanove_socijalne_zasttite>
            <Sediste>
                <Naziv></Naziv>
                <Opstina></Opstina>
            </Sediste>
        </Korisnik_ustanove_socijalne_zasttite>
        <Saglasnost>
            <Naziv_imunoloskog_leka>neki naziv</Naziv_imunoloskog_leka>
        </Saglasnost>
    </Pacijent>
    <Evidencija_o_vakcinaciji>
        <Zdravstvena_ustanova>Zdravstvena_ustanova0</Zdravstvena_ustanova>
        <Vakcinacijski_punkt>Vakcinacijski_punkt0</Vakcinacijski_punkt>
        <Lekar>
            <Ime>Ime0</Ime>
            <Prezime>Prezime0</Prezime>
            <Broj_telefona>0</Broj_telefona>
        </Lekar>
        <Vakcine>
            <Vakcina>
                <Naziv>naziv vakcine</Naziv>
                <Datum_davanja>neki datum</Datum_davanja>
                <Nacin_davanja>neki nacin</Nacin_davanja>
                <Ekstremitet>
                    <LR></LR>
                </Ekstremitet>
                <Serija>neka serija</Serija>
                <Proizvodjac>neki proizvodjac</Proizvodjac>
                <Nezeljena_reakcija></Nezeljena_reakcija>
            </Vakcina>
        </Vakcine>
        <Privremene_kontraindikacije>
            <Privremena_kontraindikacija>
                <Datum_utvrdjivanja>datum1</Datum_utvrdjivanja>
                <Dijagnoza>nesto1</Dijagnoza>
            </Privremena_kontraindikacija>
            <Privremena_kontraindikacija>
                <Datum_utvrdjivanja>datum2</Datum_utvrdjivanja>
                <Dijagnoza>nesto2</Dijagnoza>
            </Privremena_kontraindikacija>
        </Privremene_kontraindikacije>
        <Trajne_kontraindikacije></Trajne_kontraindikacije>
    </Evidencija_o_vakcinaciji>
</Saglasnost>
